url,title,employer,date_signed,fwc_id,notes
https://www.fwc.gov.au/documents/decisionssigned/html/2024fwcb123.htm,ABI Civil Contracting Services (NSW) Pty Ltd Enterprise Agreement 2024,ABI Civil Contracting Services (NSW) Pty Ltd,2024-07-15,MA000123,Construction industry agreement
https://www.fwc.gov.au/documents/decisionssigned/html/2024fwcb124.htm,Professional Services Enterprise Agreement 2024,ABC Professional Services,2024-06-20,MA000124,Professional services agreement
https://www.fwc.gov.au/documents/decisionssigned/html/2024fwcb125.htm,Manufacturing Workers Agreement 2024,XYZ Manufacturing Pty Ltd,2024-08-01,MA000125,Manufacturing sector agreement
https://www.fwc.gov.au/documents/decisionssigned/html/2024fwcb126.htm,Healthcare Enterprise Agreement 2024,Regional Healthcare Services,2024-05-30,MA000126,Healthcare sector agreement
https://www.fwc.gov.au/documents/decisionssigned/html/2024fwcb127.htm,Transport and Logistics Agreement 2024,National Transport Co,2024-07-10,MA000127,Transport industry agreement